{
  "registry_id": "registry:beta",
  "name": "Beta Registry",
  "arpa_version": "0.9.0",
  "supported_modules": [
    "ARPA-Core",
    "ARPA-Relations",
    "ARPA-Authority",
    "ARPA-Evidence"
  ],
  "supported_profiles": [
    "A",
    "C"
  ],
  "authoritative_base_uri": "https://beta.example.test",
  "conformance_declaration_uri": "https://beta.example.test/records/conformance-beta",
  "event_retention_seconds": 86400,
  "status_max_age_seconds": 300
}
